{
  "schema_version": 1,
  "id": "flat_straight",
  "name": "Flat Straight",
  "generator": {
    "version": 2,
    "seed": 0,
    "tier": 0,
    "authored": true
  },
  "length_m": 199.75,
  "centerline": [
    {
      "s": 0.0,
      "x": 0.0,
      "y": 0.0,
      "z": 0.0,
      "width": 10.0,
      "camber": 0.0
    },
    {
      "s": 4.0,
      "x": 4.0,
      "y": 0.0,
      "z": 0.0,
      "width": 10.0,
      "camber": 0.0
    },
    {
      "s": 8.0,
      "x": 8.0,
      "y": 0.0,
      "z": 0.0,
      "width": 10.0,
      "camber": 0.0
    },
    {
      "s": 12.0,
      "x": 12.0,
      "y": 0.0,
      "z": 0.0,
      "width": 10.0,
      "camber": 0.0
    },
    {
      "s": 16.0,
      "x": 16.0,
      "y": 0.0,
      "z": 0.0,
      "width": 10.0,
      "camber": 0.0
    },
    {
      "s": 20.0,
      "x": 20.0,
      "y": 0.0,
      "z": 0.0,
      "width": 10.0,
      "camber": 0.0
    },
    {
      "s": 24.0,
      "x": 24.0,
      "y": 0.0,
      "z": 0.0,
      "width": 10.0,
      "camber": 0.0
    },
    {
      "s": 28.0,
      "x": 28.0,
      "y": 0.0,
      "z": 0.0,
      "width": 10.0,
      "camber": 0.0
    },
    {
      "s": 32.0,
      "x": 32.0,
      "y": 0.0,
      "z": 0.0,
      "width": 10.0,
      "camber": 0.0
    },
    {
      "s": 36.0,
      "x": 36.0,
      "y": 0.0,
      "z": 0.0,
      "width": 10.0,
      "camber": 0.0
    },
    {
      "s": 40.0,
      "x": 40.0,
      "y": 0.0,
      "z": 0.0,
      "width": 10.0,
      "camber": 0.0
    },
    {
      "s": 44.0,
      "x": 44.0,
      "y": 0.0,
      "z": 0.0,
      "width": 10.0,
      "camber": 0.0
    },
    {
      "s": 48.0,
      "x": 48.0,
      "y": 0.0,
      "z": 0.0,
      "width": 10.0,
      "camber": 0.0
    },
    {
      "s": 52.0,
      "x": 52.0,
      "y": 0.0,
      "z": 0.0,
      "width": 10.0,
      "camber": 0.0
    },
    {
      "s": 56.0,
      "x": 56.0,
      "y": 0.0,
      "z": 0.0,
      "width": 10.0,
      "camber": 0.0
    },
    {
      "s": 60.0,
      "x": 60.0,
      "y": 0.0,
      "z": 0.0,
      "width": 10.0,
      "camber": 0.0
    },
    {
      "s": 64.0,
      "x": 64.0,
      "y": 0.0,
      "z": 0.0,
      "width": 10.0,
      "camber": 0.0
    },
    {
      "s": 68.0,
      "x": 68.0,
      "y": 0.0,
      "z": 0.0,
      "width": 10.0,
      "camber": 0.0
    },
    {
      "s": 72.0,
      "x": 72.0,
      "y": 0.0,
      "z": 0.0,
      "width": 10.0,
      "camber": 0.0
    },
    {
      "s": 76.0,
      "x": 76.0,
      "y": 0.0,
      "z": 0.0,
      "width": 10.0,
      "camber": 0.0
    },
    {
      "s": 80.0,
      "x": 80.0,
      "y": 0.0,
      "z": 0.0,
      "width": 10.0,
      "camber": 0.0
    },
    {
      "s": 84.0,
      "x": 84.0,
      "y": 0.0,
      "z": 0.0,
      "width": 10.0,
      "camber": 0.0
    },
    {
      "s": 88.0,
      "x": 88.0,
      "y": 0.0,
      "z": 0.0,
      "width": 10.0,
      "camber": 0.0
    },
    {
      "s": 92.0,
      "x": 92.0,
      "y": 0.0,
      "z": 0.0,
      "width": 10.0,
      "camber": 0.0
    },
    {
      "s": 96.0,
      "x": 96.0,
      "y": 0.0,
      "z": 0.0,
      "width": 10.0,
      "camber": 0.0
    },
    {
      "s": 100.0,
      "x": 100.0,
      "y": 0.0,
      "z": 0.0,
      "width": 10.0,
      "camber": 0.0
    },
    {
      "s": 104.0,
      "x": 104.0,
      "y": 0.0,
      "z": 0.0,
      "width": 10.0,
      "camber": 0.0
    },
    {
      "s": 108.0,
      "x": 108.0,
      "y": 0.0,
      "z": 0.0,
      "width": 10.0,
      "camber": 0.0
    },
    {
      "s": 112.0,
      "x": 112.0,
      "y": 0.0,
      "z": 0.0,
      "width": 10.0,
      "camber": 0.0
    },
    {
      "s": 116.0,
      "x": 116.0,
      "y": 0.0,
      "z": 0.0,
      "width": 10.0,
      "camber": 0.0
    },
    {
      "s": 120.0,
      "x": 120.0,
      "y": 0.0,
      "z": 0.0,
      "width": 10.0,
      "camber": 0.0
    },
    {
      "s": 124.0,
      "x": 124.0,
      "y": 0.0,
      "z": 0.0,
      "width": 10.0,
      "camber": 0.0
    },
    {
      "s": 128.0,
      "x": 128.0,
      "y": 0.0,
      "z": 0.0,
      "width": 10.0,
      "camber": 0.0
    },
    {
      "s": 132.0,
      "x": 132.0,
      "y": 0.0,
      "z": 0.0,
      "width": 10.0,
      "camber": 0.0
    },
    {
      "s": 136.0,
      "x": 136.0,
      "y": 0.0,
      "z": 0.0,
      "width": 10.0,
      "camber": 0.0
    },
    {
      "s": 140.0,
      "x": 140.0,
      "y": 0.0,
      "z": 0.0,
      "width": 10.0,
      "camber": 0.0
    },
    {
      "s": 144.0,
      "x": 144.0,
      "y": 0.0,
      "z": 0.0,
      "width": 10.0,
      "camber": 0.0
    },
    {
      "s": 148.0,
      "x": 148.0,
      "y": 0.0,
      "z": 0.0,
      "width": 10.0,
      "camber": 0.0
    },
    {
      "s": 152.0,
      "x": 152.0,
      "y": 0.0,
      "z": 0.0,
      "width": 10.0,
      "camber": 0.0
    },
    {
      "s": 156.0,
      "x": 156.0,
      "y": 0.0,
      "z": 0.0,
      "width": 10.0,
      "camber": 0.0
    },
    {
      "s": 160.0,
      "x": 160.0,
      "y": 0.0,
      "z": 0.0,
      "width": 10.0,
      "camber": 0.0
    },
    {
      "s": 164.0,
      "x": 164.0,
      "y": 0.0,
      "z": 0.0,
      "width": 10.0,
      "camber": 0.0
    },
    {
      "s": 168.0,
      "x": 168.0,
      "y": 0.0,
      "z": 0.0,
      "width": 10.0,
      "camber": 0.0
    },
    {
      "s": 172.0,
      "x": 172.0,
      "y": 0.0,
      "z": 0.0,
      "width": 10.0,
      "camber": 0.0
    },
    {
      "s": 176.0,
      "x": 176.0,
      "y": 0.0,
      "z": 0.0,
      "width": 10.0,
      "camber": 0.0
    },
    {
      "s": 180.0,
      "x": 180.0,
      "y": 0.0,
      "z": 0.0,
      "width": 10.0,
      "camber": 0.0
    },
    {
      "s": 184.0,
      "x": 184.0,
      "y": 0.0,
      "z": 0.0,
      "width": 10.0,
      "camber": 0.0
    },
    {
      "s": 188.0,
      "x": 188.0,
      "y": 0.0,
      "z": 0.0,
      "width": 10.0,
      "camber": 0.0
    },
    {
      "s": 192.0,
      "x": 192.0,
      "y": 0.0,
      "z": 0.0,
      "width": 10.0,
      "camber": 0.0
    },
    {
      "s": 196.0,
      "x": 196.0,
      "y": 0.0,
      "z": 0.0,
      "width": 10.0,
      "camber": 0.0
    },
    {
      "s": 199.75,
      "x": 199.75,
      "y": 0.0,
      "z": 0.0,
      "width": 10.0,
      "camber": 0.0
    }
  ],
  "surfaces": [
    {
      "s_start": 0.0,
      "s_end": 199.75,
      "type": "gravel",
      "mu": 0.72
    }
  ],
  "pace_notes": [],
  "obstacles": [],
  "start": {
    "s": 0.0,
    "heading": 0.0
  },
  "finish": {
    "s": 199.75
  },
  "content_hash": "sha256:969646b01bb2aceab68e063336734ac500a39d4de8e6593a01cdb72f5dcec32f"
}
